{
  "version": "1.0.0",
  "last_updated": "2026-10-02",
  "total_entries": 14,
  "entries": [
    {
      "id": "crop_boro_moisture_stress",
      "category": "crop",
      "name_en": "Boro Rice Moisture Deficit",
      "name_bn": "বোরো ধানের আর্দ্রতাজনিত পানির টান",
      "metric": "soil",
      "direction": "harm",
      "season": "boro_winter",
      "regions": ["rajshahi", "rangpur", "chapai-nawabganj", "bogra", "dinajpur", "naogaon"],
      "summary_en": "Agro-hydrological review reports that dry-season Boro rice suffers up to a 32% yield decrease under 60% soil moisture stress during critical vegetative and reproductive phases in north-western Bangladesh.",
      "summary_bn": "উত্তর-পশ্চিমাঞ্চলের কৃষি-হাইড্রোলজিক্যাল পর্যালোচনায় দেখা গেছে, উদ্ভিদের বৃদ্ধি ও শিষ গঠনের সময় ৬০% আর্দ্রতাজনিত পানির টানের মুখে বোরো ধানের ফলন ৩২% পর্যন্ত হ্রাস পায়।",
      "numbers": {
        "value": 32,
        "unit": "%",
        "what_it_measures": "Maximum yield decline under 60% soil moisture stress"
      },
      "threshold": {
        "value": 60,
        "unit": "%",
        "condition": "moisture stress deficit during panicle initiation and flowering",
        "source": "Elsevier / Nature-Based Solutions review"
      },
      "evidence_type": "review",
      "climate_link": "direct",
      "consensus": "established",
      "confidence": "high",
      "source": {
        "title": "A Review of Moisture Stress and Climate Adaptation for Rice Cultivation in Bangladesh",
        "url": "https://www.sciencedirect.com/science/article/pii/S2772411525000631",
        "publisher": "Elsevier / Nature-Based Solutions",
        "year": 2025
      },
      "last_checked": "2026-10-02"
    },
    {
      "id": "crop_rice_heat_longterm",
      "category": "crop",
      "name_en": "Rice Multi-Decadal Temperature Variability",
      "name_bn": "ধান ও দীর্ঘমেয়াদি তাপমাত্রা বৃদ্ধি (১৯৮০–২০২০)",
      "metric": "temp",
      "direction": "mixed",
      "season": "all_seasons",
      "regions": ["sylhet", "rajshahi", "dhaka", "rangpur", "khulna", "barisal", "chittagong", "mymensingh"],
      "summary_en": "Long-term econometric trend analysis (1980–2020) indicates that temperature fluctuations explain 11–47% of Aus, 4–70% of Aman, and 7–52% of Boro yield variation across Bangladesh. Aus is the most heat-stressed, while Sylhet showed positive yield responses to frequent rainfall and warm days.",
      "summary_bn": "১৯৮০–২০২০ সালের দীর্ঘমেয়াদি রিগ্রেশন বিশ্লেষণে দেখা গেছে, তাপমাত্রার ওঠানামা আউশের ক্ষেত্রে ১১–৪৭%, আমনের ক্ষেত্রে ৪–৭০% এবং বোরো ধানের ক্ষেত্রে ৭–৫২% ফলন বৈচিত্র্য ব্যাখ্যা করে। আউশ সবচেয়ে বেশি তাপদাহের ঝুঁকিতে থাকে, তবে সিলেটে নিয়মিত বৃষ্টিপাতের কারণে ফলন বৃদ্ধি লক্ষ্য করা গেছে।",
      "numbers": {
        "value": "11–47% (Aus), 4–70% (Aman), 7–52% (Boro)",
        "unit": "%",
        "what_it_measures": "Percentage of seasonal rice yield variance explained by temperature fluctuations"
      },
      "threshold": {
        "value": 35,
        "unit": "°C",
        "condition": "days exceeding 35°C (heat incidence during reproductive phase)",
        "source": "Mamun et al. (2025), Cogent Food & Agriculture"
      },
      "evidence_type": "statistical_study",
      "climate_link": "direct",
      "consensus": "established",
      "confidence": "high",
      "source": {
        "title": "Temperature variability and its effect on seasonal yield of rice in Bangladesh: a long-term trend assessment",
        "url": "https://www.tandfonline.com/doi/full/10.1080/23311932.2024.2447903",
        "publisher": "Taylor & Francis / Cogent Food & Agriculture",
        "year": 2025
      },
      "last_checked": "2026-10-02"
    },
    {
      "id": "crop_rice_extremes_plos",
      "category": "crop",
      "name_en": "Rice & Climatic Extremes Spatiotemporal Trends",
      "name_bn": "ধান ও জলবায়ু চরমভাবাপন্নতার প্রবণতা",
      "metric": "multi",
      "direction": "harm",
      "season": "all_seasons",
      "regions": ["dhaka", "mymensingh", "rajshahi", "rangpur", "sylhet"],
      "summary_en": "Non-parametric trend analysis of weather stations shows wet-season rainfall dropping significantly (>12 mm/season/yr) in central and north regions, alongside nationwide increases in dry-season dry spells. Days exceeding 36°C increased significantly at 18 stations, posing severe sterility risks to Aman rice.",
      "summary_bn": "আবহাওয়া উপাত্তের প্রবণতা বিশ্লেষণে দেখা গেছে, মধ্য ও উত্তরাঞ্চলে বর্ষাকালের বৃষ্টিপাত উল্লেখযোগ্য হারে হ্রাস পেয়েছে (>১২ মিমি/মৌসুম/বছর), বিপরীতে শুষ্ক মৌসুমে খরার ব্যাপ্তি বেড়েছে। ১৮টি স্টেশনে ৩৬°সে-এর বেশি তাপমাত্রার দিনের সংখ্যা বৃদ্ধি আমন ধানের জন্য চরম বন্ধ্যাত্বের ঝুঁকি তৈরি করছে।",
      "numbers": {
        "value": 0.5,
        "unit": "°C/decade",
        "what_it_measures": "Warming rate of wet-season maximum temperatures across meteorological stations"
      },
      "threshold": {
        "value": 36,
        "unit": "°C",
        "condition": "critical threshold above which spikelet sterility sharply increases during flowering",
        "source": "Mainuddin et al. (2022), PLOS Climate"
      },
      "evidence_type": "observed_data",
      "climate_link": "direct",
      "consensus": "established",
      "confidence": "high",
      "source": {
        "title": "Long-term spatio-temporal variability and trends in rainfall and temperature extremes and their potential risk to rice production in Bangladesh",
        "url": "https://journals.plos.org/climate/article?id=10.1371/journal.pclm.0000009",
        "publisher": "Public Library of Science (PLOS Climate)",
        "year": 2022
      },
      "last_checked": "2026-10-02"
    },
    {
      "id": "crop_rice_climatology_national",
      "category": "crop",
      "name_en": "National 65-Year Temperature & Rainfall Climatology on Rice",
      "name_bn": "দেশব্যাপী ৬৫ বছরের জলবায়ু ও ধান উৎপাদন",
      "metric": "multi",
      "direction": "mixed",
      "season": "all_seasons",
      "regions": ["all"],
      "summary_en": "Analysis of 35 BMD weather stations (1949–2013) finds that climate variability accounts for 33% (Aus), 25% (Aman), and 16% (Boro) of detrended yield variability. Maximum temperature significantly reduced Aus and Aman yields, whereas total seasonal rainfall positively influenced yields across all three crops.",
      "summary_bn": "৩৫টি আবহাওয়া স্টেশনের ৬৫ বছরের (১৯৪৯–২০১৩) উপাত্ত বিশ্লেষণে দেখা গেছে, জলবায়ু পরিবর্তন আউশের ৩৩%, আমনের ২৫% এবং বোরো ধানের ১৬% ফলন পরিবর্তন ব্যাখ্যা করে। সর্বোচ্চ তাপমাত্রা আউশ ও আমনের ফলন কমায়, তবে পর্যাপ্ত মৌসুমী বৃষ্টিপাত তিনটি জাতেরই ফলন বাড়াতে সহায়ক ভূমিকা রাখে।",
      "numbers": {
        "value": "Aus 33%, Aman 25%, Boro 16%",
        "unit": "%",
        "what_it_measures": "Percentage of detrended rice yield variance accounted for by climate variability"
      },
      "threshold": null,
      "evidence_type": "statistical_study",
      "climate_link": "direct",
      "consensus": "mixed",
      "confidence": "high",
      "source": {
        "title": "Climate change in Bangladesh: Temperature and rainfall climatology of Bangladesh for 1949–2013 and its implication on rice yield",
        "url": "https://pmc.ncbi.nlm.nih.gov/articles/PMC10569571/",
        "publisher": "PLOS One",
        "year": 2023
      },
      "last_checked": "2026-10-02"
    },
    {
      "id": "crop_rice_northwest_barind",
      "category": "crop",
      "name_en": "Northwest Barind Tract Rice Sensitivity",
      "name_bn": "উত্তর-পশ্চিমাঞ্চলের বরেন্দ্র বরো ও আমন সংবেদনশীলতা",
      "metric": "multi",
      "direction": "mixed",
      "season": "all_seasons",
      "regions": ["rajshahi", "rangpur", "bogra", "pabna", "dinajpur", "chapai-nawabganj", "naogaon"],
      "summary_en": "Multiple statistical models in northwest Bangladesh demonstrate that while rainfall affects all three rice crops, winter minimum temperatures can sometimes mitigate yield variability in irrigated Boro, contrasting with the severe negative sensitivity of rainfed Aman to summer heat and drought.",
      "summary_bn": "উত্তর-পশ্চিমাঞ্চলের বরেন্দ্র অঞ্চলে একাধিক পরিসংখ্যানগত মডেলে দেখা গেছে, বৃষ্টিপাত তিনটি মৌসুমেই প্রভাব ফেলে; তবে শীতের মৃদু সর্বনিম্ন তাপমাত্রা সেচভিত্তিক বোরো ধানের জন্য সহায়ক হতে পারে, যা বৃষ্টি-নির্ভর আমন ধানের ওপর তীব্র খরার ক্ষতিকর প্রভাবের সাথে মিশ্র বৈসাদৃশ্য তৈরি করে।",
      "numbers": {
        "value": "Aus 33%, Aman 25%, Boro 16%",
        "unit": "%",
        "what_it_measures": "Regional rice yield variance explained by climate factors in northwest drought-prone zones"
      },
      "threshold": null,
      "evidence_type": "statistical_study",
      "climate_link": "direct",
      "consensus": "mixed",
      "confidence": "high",
      "source": {
        "title": "Variability of climate-induced rice yields in northwest Bangladesh using multiple statistical modeling",
        "url": "https://link.springer.com/article/10.1007/s00704-021-03909-1",
        "publisher": "Springer / Theoretical and Applied Climatology",
        "year": 2022
      },
      "last_checked": "2026-10-02"
    },
    {
      "id": "fruit_mango_temperature_threshold",
      "category": "fruit",
      "name_en": "Mango Thermal Bounds (Chapainawabganj)",
      "name_bn": "আমের তাপমাত্রা সংবেদনশীলতা (চাঁপাইনবাবগঞ্জ)",
      "metric": "temp",
      "direction": "harm",
      "season": "summer",
      "regions": ["chapai-nawabganj", "rajshahi"],
      "summary_en": "Agro-climatological study in Chapainawabganj indicates that mango vegetative development and flowering are optimal between 25°C and 35°C; temperatures outside this window hamper budding, burn blossoms, and accelerate fruitlet drop.",
      "summary_bn": "চাঁপাইনবাবগঞ্জের আম বাগান নিয়ে পরিচালিত গবেষণায় দেখা গেছে, আমের মুকুল ও বৃদ্ধির সর্বোত্তম তাপমাত্রা ২৫°সে থেকে ৩৫°সে; তাপমাত্রা ৩৫°সে অতিক্রম করলে মুকুল পুড়ে যায় এবং কচি গুটি ঝরে পড়ে।",
      "numbers": {
        "value": "25–35",
        "unit": "°C",